{
  "baseline_run": "loop010_baseline_ste_alignment",
  "candidate_run": "loop010_candidate_ste_alignment",
  "created_at": "2026-04-28T02:58:58.983872+00:00",
  "policy": {
    "policy_id": "gate-default-v1",
    "description": "Default lightweight gate policy for the current smoke benchmark comparator."
  },
  "summary": {
    "baseline_average_quality_score": 1.0,
    "candidate_average_quality_score": 1.0,
    "average_quality_delta": 0.0,
    "baseline_failed": 0,
    "candidate_failed": 0
  },
  "gate": {
    "status": "promote",
    "policy_id": "gate-default-v1",
    "severe_regression_threshold": -0.05,
    "category_regression_threshold": -0.03,
    "severe_regression_count": 0,
    "new_failure_count": 0,
    "category_regression_count": 0,
    "blocking_reasons": []
  },
  "benchmark_readiness": {
    "item_count": 2,
    "placeholder_expected_target_count": 0,
    "placeholder_expected_target_items": [],
    "non_approved_expected_target_count": 0,
    "non_approved_expected_target_items": [],
    "ready_for_promotion": true
  },
  "category_summaries": [
    {
      "category_tag": "complex_background",
      "item_count": 1,
      "baseline_average_score": 1.0,
      "candidate_average_score": 1.0,
      "average_score_delta": 0.0
    },
    {
      "category_tag": "headline",
      "item_count": 1,
      "baseline_average_score": 1.0,
      "candidate_average_score": 1.0,
      "average_score_delta": 0.0
    },
    {
      "category_tag": "multi_region",
      "item_count": 1,
      "baseline_average_score": 1.0,
      "candidate_average_score": 1.0,
      "average_score_delta": 0.0
    },
    {
      "category_tag": "simple",
      "item_count": 1,
      "baseline_average_score": 1.0,
      "candidate_average_score": 1.0,
      "average_score_delta": 0.0
    },
    {
      "category_tag": "smoke",
      "item_count": 2,
      "baseline_average_score": 1.0,
      "candidate_average_score": 1.0,
      "average_score_delta": 0.0
    }
  ],
  "critical_summary": {
    "item_count": 1,
    "baseline_average_score": 1.0,
    "candidate_average_score": 1.0,
    "average_score_delta": 0.0,
    "severe_regression_count": 0
  },
  "item_deltas": [
    {
      "item_name": "sample1.png",
      "baseline_score": 1.0,
      "candidate_score": 1.0,
      "score_delta": 0.0,
      "baseline_failed": false,
      "candidate_failed": false,
      "category_tags": [
        "smoke",
        "simple",
        "headline"
      ],
      "critical": true
    },
    {
      "item_name": "sample2.jpg",
      "baseline_score": 1.0,
      "candidate_score": 1.0,
      "score_delta": 0.0,
      "baseline_failed": false,
      "candidate_failed": false,
      "category_tags": [
        "smoke",
        "complex_background",
        "multi_region"
      ],
      "critical": false
    }
  ]
}